{
  "scope_id": "SCOPE-CONST-AMD-01",
  "focus_ids": [
    "ORG-FED-EXE-DEP-DEFENSE"
  ],
  "exclude_ids": [
    "ORG-FED-EXE-DEP-EDUCATION"
  ],
  "max_hops": 4,
  "include_relation_classes": [
    "structural",
    "research_analysis",
    "qualification",
    "textual_candidate",
    "historical_context",
    "functional_alignment",
    "federal_observed"
  ]
}
